<?xml version="1.0" encoding="UTF-8"?>
<xs:schema xmlns:xs="http://www.w3.org/2001/XMLSchema">

  <xs:simpleType name="StateType">
    <xs:restriction base="xs:string">
      <xs:pattern value="[A-Z]{2}"/>
    </xs:restriction>
  </xs:simpleType>

  <xs:simpleType name="ZipType">
    <xs:restriction base="xs:string">
      <xs:pattern value="\d{5}"/>
    </xs:restriction>
  </xs:simpleType>

  <xs:simpleType name="PhoneType">
    <xs:restriction base="xs:string">
      <xs:pattern value="\d{3}-\d{3}-\d{4}"/>
    </xs:restriction>
  </xs:simpleType>

  <xs:simpleType name="RatingType">
    <xs:restriction base="xs:decimal">
      <xs:minInclusive value="0"/>
      <xs:maxInclusive value="5"/>
      <xs:fractionDigits value="1"/>
    </xs:restriction>
  </xs:simpleType>

  <xs:element name="Hotels">
    <xs:complexType>
      <xs:sequence>
        <xs:element name="Hotel" maxOccurs="unbounded">
          <xs:complexType>
            <xs:sequence>
              <xs:element name="Name" type="xs:string"/>
              <xs:element name="Phone" type="PhoneType" maxOccurs="unbounded"/>
              <xs:element name="Address">
                <xs:complexType>
                  <xs:sequence>
                    <xs:element name="Number" type="xs:positiveInteger"/>
                    <xs:element name="Street" type="xs:string"/>
                    <xs:element name="City" type="xs:string"/>
                    <xs:element name="State" type="StateType"/>
                    <xs:element name="Zip" type="ZipType"/>
                  </xs:sequence>
                  <xs:attribute name="NearestAirport" type="xs:string" use="required"/>
                </xs:complexType>
              </xs:element>
            </xs:sequence>
            <xs:attribute name="id" type="xs:ID" use="required"/>
            <xs:attribute name="Rating" type="RatingType" use="required"/>
          </xs:complexType>
        </xs:element>
      </xs:sequence>
    </xs:complexType>
    <xs:key name="uniqueHotelId">
      <xs:selector xpath="Hotel"/>
      <xs:field xpath="@id"/>
    </xs:key>
  </xs:element>

</xs:schema>
