<?xml version="1.0" encoding="UTF-8"?>
<!-- XML file intentionally includes validation errors for testing schema rules -->
<Hotels xmlns:xsi="http://www.w3.org/2001/XMLSchema-instance" xsi:noNamespaceSchemaLocation="Hotels.xsd">

  <!-- Invalid: Rating exceeds allowed maximum (should be equal less than 5) -->
  <Hotel id="x1" Rating="5.6">
    <Name>Bad Rating Hotel</Name>
    <!-- Invalid: Phone missing dashes (does not match pattern ###-###-####) -->
    <Phone>4809688885</Phone>
    <!-- Invalid: Attribute name spelled "NearestAirport" instead of required "NearstAirport" -->
    <Address NearestAirport="PHX">
      <!-- Invalid: State has 3 letters instead of 2 -->
      <Number>12</Number><Street>Main St</Street><City>Tempe</City><State>AZZ</State><Zip>8528</Zip>
      <!-- Invalid: Zip only 4 digits (should be 5) -->
    </Address>
  </Hotel>

  <!-- Invalid: Missing required NearstAirport attribute -->
  <Hotel id="x2" Rating="4.0">
    <Name>Missing Airport</Name>
    <Phone>480-000-0000</Phone>
    <Address>
      <Number>34</Number><Street>2nd St</Street><City>Tempe</City><State>AZ</State><Zip>85000</Zip>
    </Address>
  </Hotel>

  <!-- Invalid: Phone has +1 prefix (does not match required pattern) -->
  <Hotel id="x3" Rating="3.9">
    <Name>Bad Phone</Name>
    <Phone>+1-480-123-4567</Phone>
    <Address NearestAirport="PHX">
      <Number>56</Number><Street>3rd St</Street><City>Tempe</City><State>AZ</State><Zip>85281</Zip>
    </Address>
  </Hotel>
</Hotels>
